year,stock,source,target,sublist.holder,sublist.location,sublist.is_coreSource,sublist.table_source1,sublist.table_source2,sublist.table_source3,sublist.table_source4,market,group,taxcode.source,taxcode.target,china.note,X1,修正,非集團
2015,3323,Celxpert Holdings Limited (BVI),Advance Smart Industrial Limited (BVI),1,英屬維京群島,0,0,1,0,0,上櫃,G3323,NA,NA,NA,NA,NA,NA
2015,3323,Celxpert Holdings Limited (BVI),Celxpert Energy (H.K.) Limited,1,香港,0,0,1,0,0,上櫃,G3323,NA,NA,NA,NA,NA,NA
2015,3323,Celxpert Holdings Limited (BVI),Celxpert Energy InternationalLimited (SAMOA),1,薩摩亞,0,0,1,0,0,上櫃,G3323,NA,NA,NA,NA,NA,NA
2015,3323,加百裕工業股份有限公司,Celxpert Holdings Limited (BVI),1,英屬維京群島,1,0,1,0,0,上櫃,G3323,16271936,NA,NA,NA,NA,NA
2015,3323,Celxpert Energy (H.K.) Limited,加百裕(昆山)電子有限公司,1,china,0,1,0,1,0,上櫃,G3323,NA,NA,NA,NA,NA,NA
2015,3323,云辰投資有限公司,加百裕工業股份有限公司,NA,NA,0,0,0,0,1,上櫃,G3323,12984151,16271936,NA,NA,NA,NA
2015,3323,中光創業投資股份有限公司,加百裕工業股份有限公司,NA,NA,0,0,0,0,1,上櫃,G3323,53360475,16271936,NA,NA,NA,NA
