year,stock,source,target,sublist.holder,sublist.location,sublist.is_coreSource,sublist.table_source1,sublist.table_source2,sublist.table_source3,sublist.table_source4,market,group,taxcode.source,taxcode.target,china.note,X1,修正,非集團
2014,5230,PROCEEDS ALL INTERNATIONAL INC.,Elite Plus Limited,1,薩摩亞,0,1,0,0,0,上櫃,G5230,NA,NA,NA,NA,NA,NA
2014,5230,PROCEEDS ALL INTERNATIONAL INC.,LEDLINK OPTICS (SAMOA) INC,1,薩摩亞,0,0,1,0,0,上櫃,G5230,NA,NA,NA,NA,NA,NA
2014,5230,雷笛克光學股份有限公司,"Ledlink Optics, Inc.",1,塞席爾,1,1,0,0,0,上櫃,G5230,28951775,NA,NA,NA,NA,NA
2014,5230,雷笛克光學股份有限公司,PROCEEDS ALL INTERNATIONAL INC.,1,薩摩亞,1,0,1,0,0,上櫃,G5230,28951775,NA,NA,NA,NA,NA
2014,5230,LEDLINK OPTICS (SAMOA) INC,東莞雷笛克光學有限公司,1,china,0,1,0,1,0,上櫃,G5230,NA,NA,NA,NA,NA,NA
2014,5230,Elite Plus Limited,揚州雷笛克光學有限公司,1,china,0,1,0,1,0,上櫃,G5230,NA,NA,NA,NA,NA,NA
2014,5230,華誠創業投資股份有限公司,雷笛克光學股份有限公司,NA,NA,0,0,0,0,1,上櫃,G5230,29032115,28951775,NA,NA,NA,NA
