year,stock,source,target,sublist.holder,sublist.location,sublist.is_coreSource,sublist.table_source1,sublist.table_source2,sublist.table_source3,sublist.table_source4,market,group,taxcode.source,taxcode.target,china.note,X1,修正,非集團
2016,6165,"Jye Tai Precision Industrial (BVI) Co., Ltd.",Jye Tai Electronics Ltd.,1,香港,0,1,0,0,0,上市,G6165,NA,NA,NA,NA,NA,NA
2016,6165,捷泰精密工業股份有限公司,"Jye Tai Precision Industrial (BVI) Co., Ltd.",1,英屬維京群島,1,1,0,0,0,上市,G6165,04386575,NA,NA,NA,NA,NA
2016,6165,捷泰精密工業股份有限公司,午屹萬投資股份有限公司,1,台灣,1,1,0,0,0,上市,G6165,04386575,42657491,NA,NA,NA,NA
2016,6165,Jye Tai Electronics Ltd.,蕪湖捷泰精密工業有限公司,1,china,0,1,0,1,0,上市,G6165,NA,NA,NA,NA,NA,NA
2016,6165,Jye Tai Electronics Ltd.,蘇州捷泰精密工業有限公司,1,china,0,1,0,1,0,上市,G6165,NA,NA,NA,NA,NA,NA
