year,stock,source,target,sublist.holder,sublist.location,sublist.is_coreSource,sublist.table_source1,sublist.table_source2,sublist.table_source3,sublist.table_source4,market,group,taxcode.source,taxcode.target,china.note,X1,修正,非集團
2016,3259,日商東芝株式會社,鑫創科技股份有限公司,NA,NA,0,0,0,0,1,上櫃,G3259,NA,16766959,NA,NA,NA,NA
2016,3259,中國信託商業銀行受託保管美商金士頓科技股份有限公司投資專戶,鑫創科技股份有限公司,NA,NA,0,0,0,0,1,上櫃,G3259,NA,16766959,NA,NA,NA,NA
2016,3259,中國信託商業銀行受託保管富迪科技投資專戶,鑫創科技股份有限公司,NA,NA,0,0,0,0,1,上櫃,G3259,NA,16766959,NA,NA,NA,NA
2016,3259,立熠投資股份有限公司,鑫創科技股份有限公司,NA,NA,0,0,0,0,1,上櫃,G3259,89629829,16766959,NA,NA,NA,NA
2016,3259,鑫創科技股份有限公司,鑫識科技股份有限公司,1,台灣,0,1,0,0,0,上櫃,G3259,16766959,80131187,NA,NA,NA,NA
