year,stock,source,target,sublist.holder,sublist.location,sublist.is_coreSource,sublist.table_source1,sublist.table_source2,sublist.table_source3,sublist.table_source4,market,group,taxcode.source,taxcode.target,china.note,X1,修正,非集團
2013,3218,大學光學科技股份有限公司,UNIVERSAL GROUP (BVI) INC.,1,英屬維京群島,0,1,0,0,0,上櫃,G3218,84926791,NA,NA,NA,NA,NA
2013,3218,UNIVERSAL GROUP (BVI) INC.,"UNIVERSAL GROUP HOLDING CO., LTD.",1,開曼群島,0,1,0,0,0,上櫃,G3218,NA,NA,NA,NA,NA,NA
2013,3218,"UNIVERSAL GROUP HOLDING CO., LTD.","UNIVERSAL INTERNATIONAL (SAMOA) CO., LTD.",1,薩摩亞,0,1,0,0,0,上櫃,G3218,NA,NA,NA,NA,NA,NA
2013,3218,常福投資有限公司,大學光學科技股份有限公司,NA,NA,0,0,0,0,1,上櫃,G3218,12971114,84926791,NA,NA,NA,NA
2013,3218,瑞利投資有限公司,大學光學科技股份有限公司,NA,NA,0,0,0,0,1,上櫃,G3218,13109355,84926791,NA,NA,NA,NA
2013,3218,"UNIVERSAL INTERNATIONAL (SAMOA) CO., LTD.",太學(上海)醫療器械貿易有限公司,1,china,0,1,0,1,0,上櫃,G3218,NA,NA,NA,NA,NA,NA
2013,3218,大學光學科技股份有限公司,御龍生物科技股份有限公司,0.2,台灣,0,0,1,0,0,上櫃,G3218,84926791,53425532,NA,NA,NA,NA
