year,stock,source,target,sublist.holder,sublist.location,sublist.is_coreSource,sublist.table_source1,sublist.table_source2,sublist.table_source3,sublist.table_source4,market,group,taxcode.source,taxcode.target,china.note,X1,修正,非集團
2016,6208,日揚科技股份有限公司,Highlight Tech International Corp.,1,英屬維京群島,1,1,0,0,0,上櫃,G6208,16101031,NA,NA,NA,NA,NA
2016,6208,昇大實業有限公司,日揚科技股份有限公司,NA,NA,0,0,0,0,1,上櫃,G6208,34201759,16101031,NA,NA,NA,NA
2016,6208,Highlight Tech International Corp.,日揚電子科技(上海)有限公司,1,china,0,1,0,1,0,上櫃,G6208,NA,NA,NA,NA,NA,NA
2016,6208,日揚科技股份有限公司,立盈科技股份有限公司,0.2054,台灣,1,0,1,0,0,上櫃,G6208,16101031,80413313,NA,NA,NA,NA
2016,6208,日揚科技股份有限公司,德揚科技股份有限公司,0.4519,台灣,1,0,1,0,0,上櫃,G6208,16101031,27661171,NA,NA,NA,NA
