year,stock,source,target,sublist.holder,sublist.location,sublist.is_coreSource,sublist.table_source1,sublist.table_source2,sublist.table_source3,sublist.table_source4,market,group,taxcode.source,taxcode.target,china.note,X1,修正,非集團
2016,6627,香港展躍有限公司,飛耀貿易(深圳)有限公司,1,china,0,1,0,1,0,興櫃,G6627,NA,NA,NA,NA,NA,NA
2016,6627,薩摩亞展躍有限公司,香港展躍有限公司,1,香港,0,1,0,0,0,興櫃,G6627,NA,NA,NA,NA,NA,NA
2016,6627,飛躍文創股份有限公司,傑仕登股份有限公司,0.45,台灣,1,0,1,0,0,興櫃,G6627,53328686,27715079,NA,NA,NA,NA
2016,6627,飛躍文創股份有限公司,喆也設計顧問股份有限公司,1,台灣,1,1,0,0,0,興櫃,G6627,53328686,42989528,NA,NA,NA,NA
2016,6627,飛躍文創股份有限公司,薩摩亞展躍有限公司,1,薩摩亞,1,1,0,0,0,興櫃,G6627,53328686,NA,NA,NA,NA,NA
