year,stock,source,target,sublist.holder,sublist.location,sublist.is_coreSource,sublist.table_source1,sublist.table_source2,sublist.table_source3,sublist.table_source4,market,group,taxcode.source,taxcode.target,china.note,X1,修正,非集團
2016,5355,佳總興業股份有限公司,(香港)恆利隆貿易有限公司,1,香港,1,1,0,0,0,上櫃,G5355,23063420,NA,NA,NA,NA,NA
2016,5355,"PSC ENTERPRISE CO., LTD.","GIA TZOONG CIRCUIT ENTERPRISE CO., LTD.",1,英屬維京群島,0,1,0,0,0,上櫃,G5355,NA,NA,NA,NA,NA,NA
2016,5355,佳總興業股份有限公司,"PSC ENTERPRISE CO., LTD.",1,薩摩亞,1,1,0,0,0,上櫃,G5355,23063420,NA,NA,NA,NA,NA
2016,5355,"GIA TZOONG CIRCUIT ENTERPRISE CO., LTD.",江門佳泰電子有限公司,1,china,0,1,0,1,0,上櫃,G5355,NA,NA,NA,NA,NA,NA
2016,5355,承安投資股份有限公司,佳總興業股份有限公司,NA,NA,0,0,0,0,1,上櫃,G5355,29121897,23063420,NA,NA,NA,NA
2016,5355,江門佳泰電子有限公司,香港佳泰電子有限公司,1,香港,0,1,0,0,0,上櫃,G5355,NA,NA,NA,NA,NA,NA
