year,stock,source,target,sublist.holder,sublist.location,sublist.is_coreSource,sublist.table_source1,sublist.table_source2,sublist.table_source3,sublist.table_source4,market,group,taxcode.source,taxcode.target,china.note,X1,修正,非集團
2016,3162,精確實業股份有限公司,"United Alloy – Tech (B.V.I.) Co., Ltd.",1,英屬維京群島,1,1,0,0,0,上櫃,G3162,NA,NA,NA,NA,NA,NA
2016,3162,精確實業股份有限公司,亨泰有限公司,1,香港,1,1,0,0,0,上櫃,G3162,NA,NA,NA,NA,NA,NA
2016,3162,"United Alloy – Tech (B.V.I.) Co., Ltd.",常熟精玖旺精密機械有限公司,1,china,0,1,0,1,0,上櫃,G3162,NA,NA,NA,NA,NA,NA
2016,3162,"United Alloy – Tech (B.V.I.) Co., Ltd.",惠州精玖旺硬質合金有限公司,1,china,0,1,0,1,0,上櫃,G3162,NA,NA,NA,NA,NA,NA
2016,3162,"United Alloy – Tech (B.V.I.) Co., Ltd.",精玖旺機械(深圳)有限公司,1,china,0,1,0,1,0,上櫃,G3162,NA,NA,NA,NA,NA,NA
