year,stock,source,target,sublist.holder,sublist.location,sublist.is_coreSource,sublist.table_source1,sublist.table_source2,sublist.table_source3,sublist.table_source4,market,group,taxcode.source,taxcode.target,china.note,X1,修正,非集團
2014,3402,WHOLETECH SYSTEM HITECH INC.,WHOLETECH GROUP INTERNATIONAL TRADING LIMITED,1,模里西斯,0,1,0,0,0,上櫃,G3402,NA,NA,NA,NA,NA,NA
2014,3402,漢科系統科技股份有限公司,WHOLETECH SYSTEM HITECH INC.,1,模里西斯,1,1,0,0,0,上櫃,G3402,23830295,NA,NA,NA,NA,NA
2014,3402,漢科系統科技股份有限公司,WHOLETECH SYSTEM HITECH LIMITED,1,英屬維京群島,1,1,0,0,0,上櫃,G3402,23830295,NA,NA,NA,NA,NA
2014,3402,漢科系統科技股份有限公司,WHOLETECH SYSTEM HITECH(S) PTE. LTD.,1,新加坡,1,1,0,0,0,上櫃,G3402,23830295,NA,NA,NA,NA,NA
2014,3402,WHOLETECH SYSTEM HITECH LIMITED,漢科系統科技(上海)有限公司,1,china,0,1,0,1,0,上櫃,G3402,NA,NA,NA,NA,NA,NA
2014,3402,漢唐集成股份有限公司,漢科系統科技股份有限公司,NA,NA,0,0,0,0,1,上櫃,G3402,20938096,23830295,NA,NA,NA,NA
2014,3402,WHOLETECH GROUP INTERNATIONAL TRADING LIMITED,漢群貿易(上海)有限公司,1,china,0,1,0,1,0,上櫃,G3402,NA,NA,NA,NA,NA,NA
