year,stock,source,target,sublist.holder,sublist.location,sublist.is_coreSource,sublist.table_source1,sublist.table_source2,sublist.table_source3,sublist.table_source4,market,group,taxcode.source,taxcode.target,china.note,X1,修正,非集團
2015,3507,力群電子股份有限公司,Advanced MKS Group Corp.,1,模里西斯,1,0,1,0,0,興櫃,G3507,NA,NA,NA,NA,NA,NA
2015,3507,Advanced MKS Group Corp.,"Lihua Technology Co., Ltd.",1,模里西斯,0,0,1,0,0,興櫃,G3507,NA,NA,NA,NA,NA,NA
2015,3507,Advanced MKS Group Corp.,"Memtronics Technology Global Co., Ltd.",1,英屬維京群島,0,0,1,0,0,興櫃,G3507,NA,NA,NA,NA,NA,NA
2015,3507,Advanced MKS Group Corp.,"MNR Technology Global Co., Ltd.",0.75,開曼群島,0,0,1,0,0,興櫃,G3507,NA,NA,NA,NA,NA,NA
2015,3507,Advanced MKS Group Corp.,亞洲薄膜電子有限公司,1,香港,0,0,1,0,0,興櫃,G3507,NA,NA,NA,NA,NA,NA
2015,3507,"Memtronics Technology Global Co., Ltd.",東莞力河電子有限公司,1,china,0,1,0,1,0,興櫃,G3507,NA,NA,NA,NA,NA,NA
2015,3507,"MNR Technology Global Co., Ltd.",東莞鍵合電子有限公司,1,china,0,1,0,1,0,興櫃,G3507,NA,NA,NA,NA,NA,NA
2015,3507,"Lihua Technology Co., Ltd.",華群科技(蘇州)有限公司,1,china,0,1,0,1,0,興櫃,G3507,NA,NA,NA,NA,NA,NA
